Restaurant,Category,Item Name,Description,Price,Currency
Crispy Hen,Nashville Chicken Sandwiches,The Cheerleader Sandwich," Nashville chicken, special comeback sauce, signature coleslaw and pickles",237.12,EGP
Crispy Hen,Nashville Chicken Sandwiches,The Smokey Sandwich," Nashville chicken, smokey sauce, mushroom cheesy sauce, bacon and relish",254.22,EGP
Crispy Hen,Nashville Chicken Sandwiches,The Homey Sandwich," Nashville chicken, lettuce, roasted garlic mayonnaise, and pickles",225.72,EGP
Crispy Hen,Nashville Chicken Sandwiches,The Gobbler Sandwich," Nashville chicken, cheddar cheese, smoked turkey, honey mustard, lettuce, tomato and pickles",248.52,EGP
Crispy Hen,Nashville Chicken,Tenders 4 Pieces Meal," Served with waffle, pickles and your choice of sauce",248.52,EGP
Crispy Hen,Nashville Chicken,Tenders 8 Pieces Meal," Served with waffle, pickles and your choice of sauce",487.92,EGP
Crispy Hen,Nashville Chicken,Jumbo Wings 4 Pieces Meal," 4 pieces of whole wings (320 gm), served with half waffle, pickles and your choice of sauce",220,EGP