name,slug,description,rating,hotline
"Pizza 88","88","Authentic Italian pizzas baked in traditional stone ovens with premium imported ingredients",4.3,""
"Akleh","akleh","Authentic Lebanese cuisine with traditional mezze, grilled meats, and family recipes passed through generations",4.4,""
"Barbar","barbar","Lebanon's legendary shawarma since 1979 - authentic beef and chicken shawarma with secret family recipes",4.4,""
"Bayouki","bayoki","Premium rotisserie chicken marinated with Mediterranean spices and slow-roasted to perfection since 2015",4.3,""
"Bazooka","bazooka","Explosive burgers, crispy fried chicken, and loaded combos that pack a flavor punch since 2018",4.2,""
"BRGR","brgr","Gourmet burgers crafted with premium ingredients, artisanal buns, and chef-inspired creations since 2016",4.4,""
"Buffalo Burger","buffalo","Authentic American-style burgers with premium beef, classic flavors, and generous portions since 2017",4.5,""
"Butcher's Burger","butchers","Premium gourmet burgers made with the finest ingredients and crafted with passion!",4.6,""
"Caizo","caizo","Authentic Egyptian shawarma with premium ingredients and traditional flavors. Experience the taste of Egypt in every bite.",4.5,""
"Chez Koukou","chez","Crunchy chicken sandwiches, loaded combos, and signature sauces that deliver flavor in every bite",4.4,""
"Chikin Worx","chikin","Premium chicken sandwiches, burgers, and tenders made with passion and precision",4.6,""
"Country Hills","country","Premium American burgers, steaks, and authentic comfort food with a modern twist",4.3,""
"Crave","crave","Upscale dining experience offering international cuisine, premium steaks, seafood, and creative cocktails in elegant settings",4.6,""
"Crispy Hen","crispy","Authentic Nashville hot chicken with bold flavors and perfect crisp",4.5,""
"Crumbs","crumbs","Delicious breakfast options, creative sandwiches, and comfort food boxes served fresh daily",4.3,""
"Daddy's Burger","daddy","Gourmet burgers, crispy chicken sandwiches, and amazing sides",4.6,""
"Dawgs 'n' Shakes","dawgs","Gourmet hot dogs, crispy fried chicken sandwiches, and premium milkshakes made with love!",4.5,""
"Hameed","hameed","Authentic American Diner Experience - Burgers, Fries, Shakes & Classic Comfort Food",4.5,""
"Hashville","Hashville","Authentic Nashville-style hot chicken with explosive flavor and perfect crunch. Premium chicken sandwiches and tenders with signature sauces.",4.4,""
"Heart Attack","heart","Bold, flavorful fried chicken with signature spicy sauces and crispy perfection. Not for the faint of heart!",4.3,""
"Holmes Burgers","holmes","Premium burgers, sandwiches, and comfort food made with quality ingredients and unique recipes.",4.5,""
"Howlin' Birds","howlin","Authentic Nashville-style hot chicken sandwiches & tenders with signature heat levels and bold flavors",4.5,""
"Husk","husk","Premium burgers, sandwiches, and gourmet comfort food",4.7,""
"Kansas Chicken","kansas","Premium fried chicken with authentic American flavors, signature spices, and family meal options",4.4,""
"Kilo Kebab","kilo","Premium charcoal-grilled kebabs, shawarma, and authentic Middle Eastern cuisine with traditional recipes",4.5,""
"Labash","labash","Premium charcoal-grilled chicken, meats, and fast bites with authentic Middle Eastern flavors and traditional recipes",4.3,""
"Lord of the Wings","lord","Premium chicken wings, gourmet burgers, and amazing comfort food",4.6,""
"Maine","maine","Premium burgers, crispy chicken, and delicious fast food made with quality ingredients and authentic flavors",4.5,""
"Man'oucheh","man","Authentic Lebanese manakeesh, pizzas, and traditional breakfast items made with fresh ingredients and traditional recipes",4.5,""
"Mario's","mario","Premium burgers, chicken sandwiches, and seafood specialties crafted with quality ingredients and authentic flavors",4.7,""
"Mexican Corn","mexican","Authentic Mexican street food featuring elote, tacos, burritos, and cheesy Mexican snacks with traditional recipes and bold flavors",4.0,""
"Mince","mince","Artisanal burgers made with freshly minced beef, premium ingredients, and creative flavor combinations for the ultimate burger experience",4.6,""
"Mori Sushi","mori","Modern sushi chain serving premium rolls, fresh sashimi, and authentic Japanese bites with traditional craftsmanship and innovative flavors",4.7,""
"Pablo & Abdo","pablo","Modern diner experience with fusion cuisine, creative burgers, and innovative dishes that blend international flavors.",4.6,""
"Panda House","panda","Authentic Chinese cuisine with fresh ingredients and traditional flavors. Experience the taste of China in every bite.",4.3,""
"Pappa Roti","papa","World-famous for their signature coffee buns, artisanal baked goods, and premium coffee blends with authentic Malaysian recipes",4.5,""
"Pasta2Go","pasta","Customizable pasta bowls, fresh salads, and delicious sides - create your perfect pasta combination exactly how you like it",4.2,""
"Peking","peking","Authentic Chinese cuisine with traditional flavors and modern presentation",4.5,""
"Pickl Egypt","pickl","Dubai's famous gourmet burger chain now in Egypt. Authentic smashed burgers, crispy chicken sandwiches & hand-spun shakes.",4.7,""
"Qasr El Kababgy","qasr","Authentic Egyptian cuisine with traditional grilled meats, oriental dishes, and a royal dining experience since 1990.",4.8,""
"Chicken & Ribs","ribs","Premium grilled chicken, slow-cooked ribs, and authentic BBQ flavors made with passion!",4.5,""
"Sauce Restaurant","sauce","Contemporary dining experience offering gourmet burgers, steaks, and international cuisine with exceptional service.",4.3,""
"Second Cup Coffee","secondcup","Canada's largest specialty coffee retailer offering premium Arabica coffee, espresso beverages, and fresh baked goods in a cozy atmosphere.",4.5,""
"Pizza Station","station","Better & Bigger Real Pizza! Fresh dough, premium ingredients, and authentic Italian recipes.",4.2,""
"Tabali","tabali","Experience authentic Egyptian breakfast with traditional foul, taameya, and oriental dishes in a modern setting.",4.7,""
"Vasko","vasko","Premium patisserie offering exquisite French pastries, artisanal cakes, and specialty coffee in an elegant European setting.",4.7,""
"Koshary Ward","ward","Authentic Egyptian koshary made with traditional recipes, premium ingredients, and generous portions. Egypt's national dish perfected!",4.5,""
"What The Crust","what","Our true artisanal Neapolitan pizzas respect all the traditions and techniques that have made it world-famous. They are handcrafted by using quality local and imported Italian ingredients, in a real AVPN-approved handmade Neapolitan oven!",4.6,""
"Willy's Kitchen","willys","Gourmet burgers, premium sandwiches, and comfort food made with quality ingredients and bold flavors.",4.4,""
"Wok and Walk","wok","Fresh Asian street food with authentic flavors and quick service",4.4,""
